{
  "$schema": "https://json-schema.org/draft/2020-12/schema",
  "title": "ScreeningArtifact",
  "type": "object",
  "required": ["schemaVersion","result","scanRange","policyHash","depositIntentHash","viewingScopeCommitment","recipientCount","sanctionedHitCount","scannerCodeMeasurement","scanCompletedAtUnix"],
  "additionalProperties": false,
  "properties": {
    "schemaVersion": { "const": 1 },
    "result": { "enum": ["PASS","FAIL"] },
    "scanRange": {
      "type": "object",
      "required": ["network","startHeight","endHeight"],
      "additionalProperties": false,
      "properties": {
        "network": { "enum": ["testnet"] },
        "startHeight": { "type": "integer", "minimum": 0 },
        "endHeight": { "type": "integer", "minimum": 0 }
      }
    },
    "policyHash": { "type": "string", "pattern": "^0x[0-9a-f]{64}$" },
    "depositIntentHash": { "type": "string", "pattern": "^0x[0-9a-f]{64}$" },
    "viewingScopeCommitment": { "type": "string", "pattern": "^0x[0-9a-f]{64}$" },
    "recipientCount": { "type": "integer", "minimum": 0 },
    "sanctionedHitCount": { "type": "integer", "minimum": 0 },
    "scannerCodeMeasurement": { "type": "string", "pattern": "^0x[0-9a-f]{96}$" },
    "scanCompletedAtUnix": { "type": "integer", "minimum": 0 }
  }
}
